{
  "schema_version": "1.0",
  "dataset_id": "flywire_630",
  "model_id": "shiu_lif_rust",
  "experiment_type": "single",
  "activation": [
    {
      "selector": {
        "group_id": "sugar_grn"
      },
      "rate_hz": 50.0
    }
  ],
  "silencing": [],
  "readout": [
    {
      "selector": {
        "group_id": "mn9"
      }
    }
  ],
  "duration_ms": 100.0,
  "repeats": 1,
  "base_seed": 42,
  "report_language": "en"
}
